### ISSUE TITLE
Bot Stopped

### ISSUE THREAD

**Issue by matriixxx** [Newcomer1989/TSN-Ranksystem#760]
**Ranksystem Version:**

**Description:**
**1) What did you do?**
Since update 1.3.9 impossible to restart the bot.
I put the ip in the teamspeak 3 whitelist and always the same error.

**Ranksystem Log**
2020-08-02 22:10:30.654977   CRITICAL  Critical TS3 error on core function! Shutting down!
2020-08-02 22:10:30.654314   ERROR     TS3 Error: 110: Connection timed out

**Comment by Newcomer1989** [comment]
It could be the bot get banned from the TS3 server.

Please check the following things:

1) **Whitelist** the IP address of your webhost (where the Ranksystem runs) to your TS3 server. You should find a `query_ip_whitelist.txt` inside the TS3 server root directory. Add the IP of the webhost here.

2) Be sure your query user is not restricted with command limitation. Give the query user the TS3 permission **b_client_ignore_antiflood**. This should prefer a blocking due flood protection.

If you are not be able to change the two points above, you can try to use the **Slowmode**. This function you can activate inside the webinterface inside the TeamSpeak options. In this case use the "High delay (1,0 seconds)".
For this stop the Bot, activate the slowmode and wait 10-15 min. before restarting the Bot.

**How you could check its really a problem due a ban or flood?**

On linux there is an easy way to scan the TCP traffic. You need the packed tcpdump (apt-get install tcpdump).
There you could snip the traffic between the webserver and the TS3 server.
Run the following command on your webhost.

`tcpdump -nXvvv "src host xxx.xxx.xxx.xxx"`

Replace xxx.xxx.xxx.xxx with the IP address of your TS3 server.

**Comment by matriixxx** [comment]
Hello,

My ip is in query_ip_whitelist.txt.

the user already has the "b_client_ignore_antiflood" permission

Part against I don't understand tcpdump -nXvvv "src host xxx.xxx.xxx.xxx" lol

http://prntscr.com/tsu77p

**Comment by Newcomer1989** [comment]
You get UDP traffic.. Seems to be, you have running a Music Bot or something like this.

Try to monitor only the TPC traffic

` tcpdump -nXvvv "tcp and src host xxx.xxx.xxx.xxx"`

Your problem shouldn't be to do with the Ranksystem update. It only occurs with it.
`TS3 Error: 110: Connection timed out` means, you have connection issues between the Ranksystem host machine and the TS3 server. This is not a bot problem.

**Comment by matriixxx** [comment]
root@ns3036120:~# tcpdump -nXvvv "tcp and src host 91.121.46.30"
tcpdump: listening on eno1, link-type EN10MB (Ethernet), capture size 262144 bytes
23:38:08.169397 IP (tos 0x0, ttl 64, id 0, offset 0, flags [DF], proto TCP (6), length 60)
    91.121.46.30.22 > 51.254.207.92.57715: Flags [S.], cksum 0x8d20 (incorrect -> 0xe378), seq 4214823569, ack 2029938393, win 65160, options [mss 1460,sackOK,TS val 3280497079 ecr 734898370,nop,wscale 7], length 0
        0x0000:  4500 003c 0000 4000 4006 adca 5b79 2e1e  E..<..@.@...[y..
        0x0010:  33fe cf5c 0016 e173 fb39 1a91 78fe 66d9  3..\...s.9..x.f.
        0x0020:  a012 fe88 8d20 0000 0204 05b4 0402 080a  ................
        0x0030:  c388 69b7 2bcd a8c2 0103 0307            ..i.+.......
23:38:08.174214 IP (tos 0x0, ttl 64, id 59067, offset 0, flags [DF], proto TCP (6), length 91)
    91.121.46.30.22 > 51.254.207.92.57715: Flags [P.], cksum 0x8d3f (incorrect -> 0x7800), seq 1:40, ack 1, win 510, options [nop,nop,TS val 3280497084 ecr 734898370], length 39
        0x0000:  4500 005b e6bb 4000 4006 c6ef 5b79 2e1e  E..[..@.@...[y..
        0x0010:  33fe cf5c 0016 e173 fb39 1a92 78fe 66d9  3..\...s.9..x.f.
        0x0020:  8018 01fe 8d3f 0000 0101 080a c388 69bc  .....?........i.
        0x0030:  2bcd a8c2 5353 482d 322e 302d 4f70 656e  +...SSH-2.0-Open
        0x0040:  5353 485f 372e 3470 3120 4465 6269 616e  SSH_7.4p1.Debian
        0x0050:  2d31 302b 6465 6239 7537 0a              -10+deb9u7.
23:38:08.174409 IP (tos 0x0, ttl 64, id 59068, offset 0, flags [DF], proto TCP (6), length 52)
    91.121.46.30.22 > 51.254.207.92.57715: Flags [.], cksum 0x8d18 (incorrect -> 0x0e8e), seq 40, ack 22, win 510, options [nop,nop,TS val 3280497084 ecr 734898371], length 0
        0x0000:  4500 0034 e6bc 4000 4006 c715 5b79 2e1e  E..4..@.@...[y..
        0x0010:  33fe cf5c 0016 e173 fb39 1ab9 78fe 66ee  3..\...s.9..x.f.
        0x0020:  8010 01fe 8d18 0000 0101 080a c388 69bc  ..............i.
        0x0030:  2bcd a8c3                                +...
23:38:08.174934 IP (tos 0x0, ttl 64, id 59069, offset 0, flags [DF], proto TCP (6), length 1132)
    91.121.46.30.22 > 51.254.207.92.57715: Flags [P.], cksum 0x9150 (incorrect -> 0x9609), seq 40:1120, ack 22, win 510, options [nop,nop,TS val 3280497084 ecr 734898371], length 1080
        0x0000:  4500 046c e6bd 4000 4006 c2dc 5b79 2e1e  E..l..@.@...[y..
        0x0010:  33fe cf5c 0016 e173 fb39 1ab9 78fe 66ee  3..\...s.9..x.f.
        0x0020:  8018 01fe 9150 0000 0101 080a c388 69bc  .....P........i.
        0x0030:  2bcd a8c3 0000 0434 0614 87ba 26d1 f34a  +......4....&..J
        0x0040:  43bd cc08 1ec1 fd34 6138 0000 0102 6375  C......4a8....cu
        0x0050:  7276 6532 3535 3139 2d73 6861 3235 362c  rve25519-sha256,
        0x0060:  6375 7276 6532 3535 3139 2d73 6861 3235  curve25519-sha25
        0x0070:  3640 6c69 6273 7368 2e6f 7267 2c65 6364  6@libssh.org,ecd
        0x0080:  682d 7368 6132 2d6e 6973 7470 3235 362c  h-sha2-nistp256,
        0x0090:  6563 6468 2d73 6861 322d 6e69 7374 7033  ecdh-sha2-nistp3
        0x00a0:  3834 2c65 6364 682d 7368 6132 2d6e 6973  84,ecdh-sha2-nis
        0x00b0:  7470 3532 312c 6469 6666 6965 2d68 656c  tp521,diffie-hel
        0x00c0:  6c6d 616e 2d67 726f 7570 2d65 7863 6861  lman-group-excha
        0x00d0:  6e67 652d 7368 6132 3536 2c64 6966 6669  nge-sha256,diffi
        0x00e0:  652d 6865 6c6c 6d61 6e2d 6772 6f75 7031  e-hellman-group1
        0x00f0:  362d 7368 6135 3132 2c64 6966 6669 652d  6-sha512,diffie-
        0x0100:  6865 6c6c 6d61 6e2d 6772 6f75 7031 382d  hellman-group18-
        0x0110:  7368 6135 3132 2c64 6966 6669 652d 6865  sha512,diffie-he
        0x0120:  6c6c 6d61 6e2d 6772 6f75 7031 342d 7368  llman-group14-sh
        0x0130:  6132 3536 2c64 6966 6669 652d 6865 6c6c  a256,diffie-hell
        0x0140:  6d61 6e2d 6772 6f75 7031 342d 7368 6131  man-group14-sha1
        0x0150:  0000 0041 7373 682d 7273 612c 7273 612d  ...Assh-rsa,rsa-
        0x0160:  7368 6132 2d35 3132 2c72 7361 2d73 6861  sha2-512,rsa-sha
        0x0170:  322d 3235 362c 6563 6473 612d 7368 6132  2-256,ecdsa-sha2
        0x0180:  2d6e 6973 7470 3235 362c 7373 682d 6564  -nistp256,ssh-ed
        0x0190:  3235 3531 3900 0000 6c63 6861 6368 6132  25519...lchacha2
        0x01a0:  302d 706f 6c79 3133 3035 406f 7065 6e73  0-poly1305@opens
        0x01b0:  7368 2e63 6f6d 2c61 6573 3132 382d 6374  sh.com,aes128-ct
        0x01c0:  722c 6165 7331 3932 2d63 7472 2c61 6573  r,aes192-ctr,aes
        0x01d0:  3235 362d 6374 722c 6165 7331 3238 2d67  256-ctr,aes128-g
        0x01e0:  636d 406f 7065 6e73 7368 2e63 6f6d 2c61  cm@openssh.com,a
        0x01f0:  6573 3235 362d 6763 6d40 6f70 656e 7373  es256-gcm@openss
        0x0200:  682e 636f 6d00 0000 6c63 6861 6368 6132  h.com...lchacha2
        0x0210:  302d 706f 6c79 3133 3035 406f 7065 6e73  0-poly1305@opens
        0x0220:  7368 2e63 6f6d 2c61 6573 3132 382d 6374  sh.com,aes128-ct
        0x0230:  722c 6165 7331 3932 2d63 7472 2c61 6573  r,aes192-ctr,aes
        0x0240:  3235 362d 6374 722c 6165 7331 3238 2d67  256-ctr,aes128-g
        0x0250:  636d 406f 7065 6e73 7368 2e63 6f6d 2c61  cm@openssh.com,a
        0x0260:  6573 3235 362d 6763 6d40 6f70 656e 7373  es256-gcm@openss
        0x0270:  682e 636f 6d00 0000 d575 6d61 632d 3634  h.com....umac-64
        0x0280:  2d65 746d 406f 7065 6e73 7368 2e63 6f6d  -etm@openssh.com
        0x0290:  2c75 6d61 632d 3132 382d 6574 6d40 6f70  ,umac-128-etm@op
        0x02a0:  656e 7373 682e 636f 6d2c 686d 6163 2d73  enssh.com,hmac-s
        0x02b0:  6861 322d 3235 362d 6574 6d40 6f70 656e  ha2-256-etm@open
        0x02c0:  7373 682e 636f 6d2c 686d 6163 2d73 6861  ssh.com,hmac-sha
        0x02d0:  322d 3531 322d 6574 6d40 6f70 656e 7373  2-512-etm@openss
        0x02e0:  682e 636f 6d2c 686d 6163 2d73 6861 312d  h.com,hmac-sha1-
        0x02f0:  6574 6d40 6f70 656e 7373 682e 636f 6d2c  etm@openssh.com,
        0x0300:  756d 6163 2d36 3440 6f70 656e 7373 682e  umac-64@openssh.
        0x0310:  636f 6d2c 756d 6163 2d31 3238 406f 7065  com,umac-128@ope
        0x0320:  6e73 7368 2e63 6f6d 2c68 6d61 632d 7368  nssh.com,hmac-sh
        0x0330:  6132 2d32 3536 2c68 6d61 632d 7368 6132  a2-256,hmac-sha2
        0x0340:  2d35 3132 2c68 6d61 632d 7368 6131 0000  -512,hmac-sha1..
        0x0350:  00d5 756d 6163 2d36 342d 6574 6d40 6f70  ..umac-64-etm@op
        0x0360:  656e 7373 682e 636f 6d2c 756d 6163 2d31  enssh.com,umac-1
        0x0370:  3238 2d65 746d 406f 7065 6e73 7368 2e63  28-etm@openssh.c
        0x0380:  6f6d 2c68 6d61 632d 7368 6132 2d32 3536  om,hmac-sha2-256
        0x0390:  2d65 746d 406f 7065 6e73 7368 2e63 6f6d  -etm@openssh.com
        0x03a0:  2c68 6d61 632d 7368 6132 2d35 3132 2d65  ,hmac-sha2-512-e
        0x03b0:  746d 406f 7065 6e73 7368 2e63 6f6d 2c68  tm@openssh.com,h
        0x03c0:  6d61 632d 7368 6131 2d65 746d 406f 7065  mac-sha1-etm@ope
        0x03d0:  6e73 7368 2e63 6f6d 2c75 6d61 632d 3634  nssh.com,umac-64
        0x03e0:  406f 7065 6e73 7368 2e63 6f6d 2c75 6d61  @openssh.com,uma
        0x03f0:  632d 3132 3840 6f70 656e 7373 682e 636f  c-128@openssh.co
        0x0400:  6d2c 686d 6163 2d73 6861 322d 3235 362c  m,hmac-sha2-256,
        0x0410:  686d 6163 2d73 6861 322d 3531 322c 686d  hmac-sha2-512,hm
        0x0420:  6163 2d73 6861 3100 0000 156e 6f6e 652c  ac-sha1....none,
        0x0430:  7a6c 6962 406f 7065 6e73 7368 2e63 6f6d  zlib@openssh.com
        0x0440:  0000 0015 6e6f 6e65 2c7a 6c69 6240 6f70  ....none,zlib@op
        0x0450:  656e 7373 682e 636f 6d00 0000 0000 0000  enssh.com.......
        0x0460:  0000 0000 0000 0000 0000 0000            ............
23:38:08.217895 IP (tos 0x0, ttl 64, id 59070, offset 0, flags [DF], proto TCP (6), length 52)
    91.121.46.30.22 > 51.254.207.92.57715: Flags [.], cksum 0x8d18 (incorrect -> 0x0876), seq 1120, ack 462, win 507, options [nop,nop,TS val 3280497127 ecr 734898371], length 0
        0x0000:  4500 0034 e6be 4000 4006 c713 5b79 2e1e  E..4..@.@...[y..
        0x0010:  33fe cf5c 0016 e173 fb39 1ef1 78fe 68a6  3..\...s.9..x.h.
        0x0020:  8010 01fb 8d18 0000 0101 080a c388 69e7  ..............i.
        0x0030:  2bcd a8c3                                +...
23:38:08.218197 IP (tos 0x0, ttl 64, id 59071, offset 0, flags [DF], proto TCP (6), length 52)
    91.121.46.30.22 > 51.254.207.92.57715: Flags [.], cksum 0x8d18 (incorrect -> 0x083a), seq 1120, ack 510, win 507, options [nop,nop,TS val 3280497128 ecr 734898382], length 0
        0x0000:  4500 0034 e6bf 4000 4006 c712 5b79 2e1e  E..4..@.@...[y..
        0x0010:  33fe cf5c 0016 e173 fb39 1ef1 78fe 68d6  3..\...s.9..x.h.
        0x0020:  8010 01fb 8d18 0000 0101 080a c388 69e8  ..............i.
        0x0030:  2bcd a8ce                                +...
23:38:08.222715 IP (tos 0x0, ttl 64, id 59072, offset 0, flags [DF], proto TCP (6), length 332)
    91.121.46.30.22 > 51.254.207.92.57715: Flags [P.], cksum 0x8e30 (incorrect -> 0x8094), seq 1120:1400, ack 510, win 507, options [nop,nop,TS val 3280497132 ecr 734898382], length 280
        0x0000:  4500 014c e6c0 4000 4006 c5f9 5b79 2e1e  E..L..@.@...[y..
        0x0010:  33fe cf5c 0016 e173 fb39 1ef1 78fe 68d6  3..\...s.9..x.h.
        0x0020:  8018 01fb 8e30 0000 0101 080a c388 69ec  .....0........i.
        0x0030:  2bcd a8ce 0000 0104 0b1f 0000 0068 0000  +............h..
        0x0040:  0013 6563 6473 612d 7368 6132 2d6e 6973  ..ecdsa-sha2-nis
        0x0050:  7470 3235 3600 0000 086e 6973 7470 3235  tp256....nistp25
        0x0060:  3600 0000 4104 a76c e97a 24aa 15ee 8f58  6...A..l.z$....X
        0x0070:  a940 c9fd c6a4 69d9 ff0c 5229 dc1f 0b83  .@....i...R)....
        0x0080:  22bd 51dd b94a a75d ae71 4a09 319e a93f  ".Q..J.].qJ.1..?
        0x0090:  63e4 800a be88 ac93 a33f ec55 ef15 d94c  c........?.U...L
        0x00a0:  cd0e dc68 ea77 0000 0020 8eae 3ef9 f901  ...h.w......>...
        0x00b0:  cd8a b849 8933 7155 d021 da32 14f5 34b3  ...I.3qU.!.2..4.
        0x00c0:  353c 7675 7f6c ff71 2175 0000 0063 0000  5<vu.l.q!u...c..
        0x00d0:  0013 6563 6473 612d 7368 6132 2d6e 6973  ..ecdsa-sha2-nis
        0x00e0:  7470 3235 3600 0000 4800 0000 2055 3fb4  tp256...H....U?.
        0x00f0:  da20 c369 35f0 be61 4ffb 331f 70bf b2bf  ...i5..aO.3.p...
        0x0100:  e940 989e cea6 02e8 ff32 9e05 9b00 0000  .@.......2......
        0x0110:  2022 4aca f225 80ea 218c 07d2 a256 d837  ."J..%..!....V.7
        0x0120:  e459 29bf 49ba a0e8 26ac ac2c 3b1c 398b  .Y).I...&..,;.9.
        0x0130:  2900 0000 0000 0000 0000 0000 0000 000c  )...............
        0x0140:  0a15 0000 0000 0000 0000 0000            ............
23:38:08.889887 IP (tos 0x0, ttl 64, id 59073, offset 0, flags [DF], proto TCP (6), length 52)
    91.121.46.30.22 > 51.254.207.92.57715: Flags [.], cksum 0x8d18 (incorrect -> 0x03d6), seq 1400, ack 526, win 507, options [nop,nop,TS val 3280497799 ecr 734898539], length 0
        0x0000:  4500 0034 e6c1 4000 4006 c710 5b79 2e1e  E..4..@.@...[y..
        0x0010:  33fe cf5c 0016 e173 fb39 2009 78fe 68e6  3..\...s.9..x.h.
        0x0020:  8010 01fb 8d18 0000 0101 080a c388 6c87  ..............l.
        0x0030:  2bcd a96b                                +..k
23:38:08.890161 IP (tos 0x0, ttl 64, id 59074, offset 0, flags [DF], proto TCP (6), length 52)
    91.121.46.30.22 > 51.254.207.92.57715: Flags [.], cksum 0x8d18 (incorrect -> 0x0396), seq 1400, ack 578, win 507, options [nop,nop,TS val 3280497800 ecr 734898550], length 0
        0x0000:  4500 0034 e6c2 4000 4006 c70f 5b79 2e1e  E..4..@.@...[y..
        0x0010:  33fe cf5c 0016 e173 fb39 2009 78fe 691a  3..\...s.9..x.i.
        0x0020:  8010 01fb 8d18 0000 0101 080a c388 6c88  ..............l.
        0x0030:  2bcd a976                                +..v
23:38:08.890202 IP (tos 0x0, ttl 64, id 59075, offset 0, flags [DF], proto TCP (6), length 104)
    91.121.46.30.22 > 51.254.207.92.57715: Flags [P.], cksum 0x8d4c (incorrect -> 0xdda6), seq 1400:1452, ack 578, win 507, options [nop,nop,TS val 3280497800 ecr 734898550], length 52
        0x0000:  4500 0068 e6c3 4000 4006 c6da 5b79 2e1e  E..h..@.@...[y..
        0x0010:  33fe cf5c 0016 e173 fb39 2009 78fe 691a  3..\...s.9..x.i.
        0x0020:  8018 01fb 8d4c 0000 0101 080a c388 6c88  .....L........l.
        0x0030:  2bcd a976 c077 b054 3b4e 8ca8 09ac d33f  +..v.w.T;N.....?
        0x0040:  ac01 03e3 5075 4b9a d9c4 b72e 8d12 dc68  ....PuK........h
        0x0050:  11d3 b616 e6c4 8cea 9655 b72f 8618 8dce  .........U./....
        0x0060:  faf7 af8b bade c738                      .......8
23:38:09.029893 IP (tos 0x0, ttl 64, id 59076, offset 0, flags [DF], proto TCP (6), length 52)
    91.121.46.30.22 > 51.254.207.92.57715: Flags [.], cksum 0x8d18 (incorrect -> 0x026a), seq 1452, ack 662, win 507, options [nop,nop,TS val 3280497939 ecr 734898575], length 0
        0x0000:  4500 0034 e6c4 4000 4006 c70d 5b79 2e1e  E..4..@.@...[y..
        0x0010:  33fe cf5c 0016 e173 fb39 203d 78fe 696e  3..\...s.9.=x.in
        0x0020:  8010 01fb 8d18 0000 0101 080a c388 6d13  ..............m.
        0x0030:  2bcd a98f                                +...
23:38:11.021132 IP (tos 0x0, ttl 64, id 59077, offset 0, flags [DF], proto TCP (6), length 120)
    91.121.46.30.22 > 51.254.207.92.57715: Flags [P.], cksum 0x8d5c (incorrect -> 0x41b9), seq 1452:1520, ack 662, win 507, options [nop,nop,TS val 3280499931 ecr 734898575], length 68
        0x0000:  4500 0078 e6c5 4000 4006 c6c8 5b79 2e1e  E..x..@.@...[y..
        0x0010:  33fe cf5c 0016 e173 fb39 203d 78fe 696e  3..\...s.9.=x.in
        0x0020:  8018 01fb 8d5c 0000 0101 080a c388 74db  .....\........t.
        0x0030:  2bcd a98f 11ef dbdf dac6 185e d77e b130  +..........^.~.0
        0x0040:  dda8 12bf 5d0e 5b33 9577 3dbf d7b1 7d9a  ....].[3.w=...}.
        0x0050:  b960 cb40 8a2d 1a59 b3f7 a678 f511 292d  .`.@.-.Y...x..)-
        0x0060:  7402 340c b97b eb4f 5c6a 0060 069f 8979  t.4..{.O\j.`...y
        0x0070:  6db2 5d80 afbf 2745                      m.]...'E
23:38:11.021410 IP (tos 0x0, ttl 64, id 59078, offset 0, flags [DF], proto TCP (6), length 52)
    91.121.46.30.22 > 51.254.207.92.57715: Flags [.], cksum 0x8d18 (incorrect -> 0xf82d), seq 1520, ack 714, win 507, options [nop,nop,TS val 3280499931 ecr 734899083], length 0
        0x0000:  4500 0034 e6c6 4000 4006 c70b 5b79 2e1e  E..4..@.@...[y..
        0x0010:  33fe cf5c 0016 e173 fb39 2081 78fe 69a2  3..\...s.9..x.i.
        0x0020:  8010 01fb 8d18 0000 0101 080a c388 74db  ..............t.
        0x0030:  2bcd ab8b                                +...
23:38:11.021914 IP (tos 0x0, ttl 64, id 59079, offset 0, flags [DF], proto TCP (6), length 52)
    91.121.46.30.22 > 51.254.207.92.57715: Flags [F.], cksum 0x8d18 (incorrect -> 0xf82b), seq 1520, ack 715, win 507, options [nop,nop,TS val 3280499931 ecr 734899083], length 0
        0x0000:  4500 0034 e6c7 4000 4006 c70a 5b79 2e1e  E..4..@.@...[y..
        0x0010:  33fe cf5c 0016 e173 fb39 2081 78fe 69a3  3..\...s.9..x.i.
        0x0020:  8011 01fb 8d18 0000 0101 080a c388 74db  ..............t.
        0x0030:  2bcd ab8b                                +...
^[[4~^C
14 packets captured
17 packets received by filter
0 packets dropped by kernel
root@ns3036120:~#

**Comment by Newcomer1989** [comment]
I can't read anything.. Please push something like this with https://pastebin.com

**Comment by matriixxx** [comment]
https://pastebin.com/wTPK1tKF

**Comment by Newcomer1989** [comment]
Seems to be you are using a SSH connection.

We would need a full ranksystem.log since the last startup.

**Comment by matriixxx** [comment]
https://pastebin.com/anpfVMKA

**Comment by Newcomer1989** [comment]
What happened here??

> 2020-08-02 22:30:54.307295   NONE      Connect to TS3 Server (Address: "ts.batar.eu" Voice-Port: "9811" Query$2020-08-02 

This is not right. It looks like this?

**Comment by matriixxx** [comment]
https://pastebin.com/Shj2UcJf
always modify the same error.

**Comment by Newcomer1989** [comment]
I can't see any mistake on your entered data. Also no error of the Bot.

This is a problem with your infrastructure. We can't help you here, since we do not know your infrastructure and there could be a couple of hundred things to be checked. This would be a never ending story of asking questions here.

We need to close this issue at this point.
